{
  "id": "inst.critical-power",
  "name_key": "instrument.critical_power.name",
  "object": "On the ward, the Spine colour lamps and the chalk board line; in the Crown, the Measure's slate map pierced with holes backed by oil wicks glazed green, amber or clear, and the weight room's one suspended weight per declared dependency.",
  "comparable_with": ["inst.staffing-board", "inst.chronology"],
  "never_implies": [
    "that restored means the dependency is corrected",
    "that a green lamp is a statement about readiness"
  ],
  "text_equivalent_key": "instrument.critical_power.text",
  "unresolved": null,
  "derivedFrom": "Canon, chapter-01-the-shadow-at-first-light-v0.2.md: 'The central display monitors the generator and the main critical bus; it does not initially see the failed downstream board.' Object from 02-world/sensory-canon-v0.1.md."
}
